{
  "$schema": "https://json-schema.org/draft/2020-12/schema",
  "$id": "https://tradition-learning-community.github.io/tllib-specs/handoff/schemas/domain-catalog.schema.json",
  "title": "Feature Handoff Domain Catalog v1.0",
  "type": "object",
  "additionalProperties": false,
  "required": [
    "schema_version",
    "package_model_version",
    "domain",
    "domain_index",
    "expected_feature_count",
    "ordered_feature_ids",
    "feature_packages",
    "statuses",
    "shared_dependencies",
    "metadata"
  ],
  "properties": {
    "schema_version": {"const": "1.0"},
    "package_model_version": {"const": "1.0.0"},
    "domain": {
      "type": "string",
      "pattern": "^[a-z0-9]+(?:-[a-z0-9]+)*$"
    },
    "domain_index": {
      "type": "integer",
      "minimum": 0,
      "maximum": 99
    },
    "expected_feature_count": {
      "type": "integer",
      "minimum": 1
    },
    "ordered_feature_ids": {
      "type": "array",
      "minItems": 1,
      "uniqueItems": true,
      "items": {
        "type": "string",
        "pattern": "^TLC-FC-[0-9]{2}-[A-Z][A-Z0-9-]*-[0-9]{3}$"
      }
    },
    "feature_packages": {
      "type": "array",
      "minItems": 1,
      "items": {
        "type": "object",
        "additionalProperties": false,
        "required": ["feature_id", "path", "package_version", "status"],
        "properties": {
          "feature_id": {
            "type": "string",
            "pattern": "^TLC-FC-[0-9]{2}-[A-Z][A-Z0-9-]*-[0-9]{3}$"
          },
          "path": {
            "type": "string",
            "pattern": "^handoff/features/TLC-FC-[0-9]{2}-[A-Z][A-Z0-9-]*-[0-9]{3}$"
          },
          "package_version": {
            "type": "string",
            "pattern": "^[0-9]+\\.[0-9]+\\.[0-9]+$"
          },
          "status": {
            "enum": ["draft", "pilot", "validated", "finalized", "deprecated", "superseded"]
          }
        }
      }
    },
    "statuses": {
      "type": "object",
      "additionalProperties": false,
      "required": ["population", "validation"],
      "properties": {
        "population": {"const": "complete"},
        "validation": {"enum": ["pending", "validated"]}
      }
    },
    "shared_dependencies": {
      "type": "array",
      "uniqueItems": true,
      "items": {
        "type": "object",
        "additionalProperties": false,
        "required": ["shared_contract_id", "version"],
        "properties": {
          "shared_contract_id": {
            "type": "string",
            "pattern": "^TLC-HC-[A-Z0-9-]+$"
          },
          "version": {
            "type": "string",
            "pattern": "^[0-9]+\\.[0-9]+\\.[0-9]+$"
          }
        }
      }
    },
    "metadata": {
      "type": "object",
      "additionalProperties": false,
      "required": ["authoritative_inventory", "generated_by", "validation_tool"],
      "properties": {
        "authoritative_inventory": {
          "type": "string",
          "pattern": "^registry/domain-finalization/[a-z0-9]+(?:-[a-z0-9]+)*/feature-status\\.yaml$"
        },
        "generated_by": {"type": "string", "minLength": 1},
        "validation_tool": {"const": "tools/handoff/validate_handoff.py"},
        "source_commit": {
          "type": ["string", "null"],
          "pattern": "^[0-9a-f]{40}$"
        }
      }
    }
  }
}
