{
  "schema_version": "1.0",
  "package_model_version": "1.0.0",
  "domain": "message",
  "domain_index": 7,
  "expected_feature_count": 6,
  "ordered_feature_ids": [
    "TLC-FC-07-MESSAGE-001",
    "TLC-FC-07-MESSAGE-002",
    "TLC-FC-07-MESSAGE-003",
    "TLC-FC-07-MESSAGE-004",
    "TLC-FC-07-MESSAGE-005",
    "TLC-FC-07-MESSAGE-006"
  ],
  "feature_packages": [
    {"feature_id": "TLC-FC-07-MESSAGE-001", "path": "handoff/features/TLC-FC-07-MESSAGE-001", "package_version": "1.0.0", "status": "finalized"},
    {"feature_id": "TLC-FC-07-MESSAGE-002", "path": "handoff/features/TLC-FC-07-MESSAGE-002", "package_version": "1.0.0", "status": "finalized"},
    {"feature_id": "TLC-FC-07-MESSAGE-003", "path": "handoff/features/TLC-FC-07-MESSAGE-003", "package_version": "1.0.0", "status": "finalized"},
    {"feature_id": "TLC-FC-07-MESSAGE-004", "path": "handoff/features/TLC-FC-07-MESSAGE-004", "package_version": "1.0.0", "status": "finalized"},
    {"feature_id": "TLC-FC-07-MESSAGE-005", "path": "handoff/features/TLC-FC-07-MESSAGE-005", "package_version": "1.0.0", "status": "finalized"},
    {"feature_id": "TLC-FC-07-MESSAGE-006", "path": "handoff/features/TLC-FC-07-MESSAGE-006", "package_version": "1.0.0", "status": "finalized"}
  ],
  "statuses": {"population": "complete", "validation": "validated"},
  "shared_dependencies": [
    {"shared_contract_id": "TLC-HC-FEATURE-ID", "version": "1.0.0"},
    {"shared_contract_id": "TLC-HC-SCIENTIFIC-REFERENCE", "version": "1.0.0"},
    {"shared_contract_id": "TLC-HC-REFERENCE-COLLECTION", "version": "1.0.0"},
    {"shared_contract_id": "TLC-HC-UNRESOLVED-ITEM", "version": "1.0.0"},
    {"shared_contract_id": "TLC-HC-OPAQUE-VALUE", "version": "1.0.0"},
    {"shared_contract_id": "TLC-HC-STRUCTURED-ERROR", "version": "1.0.0"},
    {"shared_contract_id": "TLC-HC-TRACEABILITY", "version": "1.0.0"},
    {"shared_contract_id": "TLC-HC-DESCRIPTOR-ENVELOPE", "version": "1.0.0"}
  ],
  "metadata": {
    "authoritative_inventory": "registry/domain-finalization/message/feature-status.yaml",
    "generated_by": "Feature Handoff Package compiler for domain 07 Message",
    "validation_tool": "tools/handoff/validate_handoff.py",
    "source_commit": "022e6076ceeeb87b31065f2a9a28e95f1811d077"
  }
}
