{
  "schema_version": "1.0",
  "package_model_version": "1.0.0",
  "domain": "reflexivity",
  "domain_index": 27,
  "expected_feature_count": 9,
  "ordered_feature_ids": [
    "TLC-FC-27-REFLEXIVITY-001",
    "TLC-FC-27-REFLEXIVITY-002",
    "TLC-FC-27-REFLEXIVITY-003",
    "TLC-FC-27-REFLEXIVITY-004",
    "TLC-FC-27-REFLEXIVITY-005",
    "TLC-FC-27-REFLEXIVITY-006",
    "TLC-FC-27-REFLEXIVITY-007",
    "TLC-FC-27-REFLEXIVITY-008",
    "TLC-FC-27-REFLEXIVITY-009"
  ],
  "feature_packages": [
    {"feature_id":"TLC-FC-27-REFLEXIVITY-001","path":"handoff/features/TLC-FC-27-REFLEXIVITY-001","package_version":"1.0.0","status":"finalized"},
    {"feature_id":"TLC-FC-27-REFLEXIVITY-002","path":"handoff/features/TLC-FC-27-REFLEXIVITY-002","package_version":"1.0.0","status":"finalized"},
    {"feature_id":"TLC-FC-27-REFLEXIVITY-003","path":"handoff/features/TLC-FC-27-REFLEXIVITY-003","package_version":"1.0.0","status":"finalized"},
    {"feature_id":"TLC-FC-27-REFLEXIVITY-004","path":"handoff/features/TLC-FC-27-REFLEXIVITY-004","package_version":"1.0.0","status":"finalized"},
    {"feature_id":"TLC-FC-27-REFLEXIVITY-005","path":"handoff/features/TLC-FC-27-REFLEXIVITY-005","package_version":"1.0.0","status":"finalized"},
    {"feature_id":"TLC-FC-27-REFLEXIVITY-006","path":"handoff/features/TLC-FC-27-REFLEXIVITY-006","package_version":"1.0.0","status":"finalized"},
    {"feature_id":"TLC-FC-27-REFLEXIVITY-007","path":"handoff/features/TLC-FC-27-REFLEXIVITY-007","package_version":"1.0.0","status":"finalized"},
    {"feature_id":"TLC-FC-27-REFLEXIVITY-008","path":"handoff/features/TLC-FC-27-REFLEXIVITY-008","package_version":"1.0.0","status":"finalized"},
    {"feature_id":"TLC-FC-27-REFLEXIVITY-009","path":"handoff/features/TLC-FC-27-REFLEXIVITY-009","package_version":"1.0.0","status":"finalized"}
  ],
  "statuses": {"population":"complete","validation":"validated"},
  "shared_dependencies": [
    {"shared_contract_id":"TLC-HC-FEATURE-ID","version":"1.0.0"},
    {"shared_contract_id":"TLC-HC-SCIENTIFIC-REFERENCE","version":"1.0.0"},
    {"shared_contract_id":"TLC-HC-REFERENCE-COLLECTION","version":"1.0.0"},
    {"shared_contract_id":"TLC-HC-UNRESOLVED-ITEM","version":"1.0.0"},
    {"shared_contract_id":"TLC-HC-OPAQUE-VALUE","version":"1.0.0"},
    {"shared_contract_id":"TLC-HC-STRUCTURED-ERROR","version":"1.0.0"},
    {"shared_contract_id":"TLC-HC-TRACEABILITY","version":"1.0.0"},
    {"shared_contract_id":"TLC-HC-DESCRIPTOR-ENVELOPE","version":"1.0.0"}
  ],
  "metadata": {
    "authoritative_inventory":"registry/domain-finalization/reflexivity/feature-status.yaml",
    "generated_by":"reflexivity domain production compiler",
    "validation_tool":"tools/handoff/validate_handoff.py",
    "source_commit":"6f989e75aba0f4795e8d5cc42ab83107c7767d57"
  }
}
