{
  "schema_version": "1.0",
  "package_model_version": "1.0.0",
  "domain": "community",
  "domain_index": 2,
  "expected_feature_count": 8,
  "ordered_feature_ids": [
    "TLC-FC-02-COMMUNITY-001",
    "TLC-FC-02-COMMUNITY-003",
    "TLC-FC-02-COMMUNITY-004",
    "TLC-FC-02-COMMUNITY-005",
    "TLC-FC-02-COMMUNITY-006",
    "TLC-FC-02-COMMUNITY-007",
    "TLC-FC-02-COMMUNITY-008",
    "TLC-FC-02-COMMUNITY-009"
  ],
  "feature_packages": [
    {"feature_id": "TLC-FC-02-COMMUNITY-001", "path": "handoff/features/TLC-FC-02-COMMUNITY-001", "package_version": "1.0.0", "status": "finalized"},
    {"feature_id": "TLC-FC-02-COMMUNITY-003", "path": "handoff/features/TLC-FC-02-COMMUNITY-003", "package_version": "1.0.0", "status": "finalized"},
    {"feature_id": "TLC-FC-02-COMMUNITY-004", "path": "handoff/features/TLC-FC-02-COMMUNITY-004", "package_version": "1.0.0", "status": "finalized"},
    {"feature_id": "TLC-FC-02-COMMUNITY-005", "path": "handoff/features/TLC-FC-02-COMMUNITY-005", "package_version": "1.0.0", "status": "finalized"},
    {"feature_id": "TLC-FC-02-COMMUNITY-006", "path": "handoff/features/TLC-FC-02-COMMUNITY-006", "package_version": "1.0.0", "status": "finalized"},
    {"feature_id": "TLC-FC-02-COMMUNITY-007", "path": "handoff/features/TLC-FC-02-COMMUNITY-007", "package_version": "1.0.0", "status": "finalized"},
    {"feature_id": "TLC-FC-02-COMMUNITY-008", "path": "handoff/features/TLC-FC-02-COMMUNITY-008", "package_version": "1.0.0", "status": "finalized"},
    {"feature_id": "TLC-FC-02-COMMUNITY-009", "path": "handoff/features/TLC-FC-02-COMMUNITY-009", "package_version": "1.0.0", "status": "finalized"}
  ],
  "statuses": {"population": "complete", "validation": "pending"},
  "shared_dependencies": [
    {"shared_contract_id": "TLC-HC-FEATURE-ID", "version": "1.0.0"},
    {"shared_contract_id": "TLC-HC-SCIENTIFIC-REFERENCE", "version": "1.0.0"},
    {"shared_contract_id": "TLC-HC-REFERENCE-COLLECTION", "version": "1.0.0"},
    {"shared_contract_id": "TLC-HC-UNRESOLVED-ITEM", "version": "1.0.0"},
    {"shared_contract_id": "TLC-HC-OPAQUE-VALUE", "version": "1.0.0"},
    {"shared_contract_id": "TLC-HC-STRUCTURED-ERROR", "version": "1.0.0"},
    {"shared_contract_id": "TLC-HC-TRACEABILITY", "version": "1.0.0"},
    {"shared_contract_id": "TLC-HC-DESCRIPTOR-ENVELOPE", "version": "1.0.0"}
  ],
  "metadata": {
    "authoritative_inventory": "registry/domain-finalization/community/feature-status.yaml",
    "generated_by": "Feature Handoff Package v1.0 Community compiler",
    "validation_tool": "tools/handoff/validate_handoff.py",
    "source_commit": "21440c05372546b8d3b605f3368680e78a1d3778"
  }
}